question;transformed;true_answer;num_answers;source;context
"Information systems managers can be partly compared to architects.
Read the following statement and discuss similarities and differences between information system architects and building architects [8]:

“We are architects.
[…] We have designed numerous buildings, used by many people.
[…] We know what users want.
We know their complaints: buildings that get in the way of the things they want to do.
[…] We also know the users’ joy of relaxing, working, learning, buying, manufacturing, and worshipping in buildings which were designed with love and care as well as function in mind.
[…] We are committed to the belief that buildings can help people to do their jobs or may impede them and that good buildings bring joy as well as efficiency.”
";"Information systems managers can be partly compared to architects.
Read the following statement and discuss similarities and differences between information system architects and building architects:

“We are architects.
[…] We have designed numerous buildings, used by many people.
[…] We know what users want.
We know their complaints: buildings that get in the way of the things they want to do.
[…] We also know the users’ joy of relaxing, working, learning, buying, manufacturing, and worshipping in buildings which were designed with love and care as well as function in mind.
[…] We are committed to the belief that buildings can help people to do their jobs or may impede them and that good buildings bring joy as well as efficiency.”
";"Health information managers can indeed be compared with architects.
Health information managers design information systems that are used by many different user groups.
Health information managers regularly monitor the quality of information systems to obtain feedback and to improve the information system.
Health information managers understand that information systems support many different functions for many different user groups within health care facilities.
Health information managers make sure that the application systems are user-friendly and support working processes in an efficient way.
Health information managers understand that an information system serves the overall goal of a health care facility and ultimately serves the need of the patients.
";6;Book;
"A clinical researcher at Ploetzberg Hospital has won a grant to set up a register for patients who have received a knee endoprosthesis.
Disease registers are research databases for collecting data about a specific disease, aiming for full coverage of the respective patient collective.
The aim of a knee endoprosthesis registry is to collect longitudinal data to find out which type of endoprosthesis works best over time.
The researcher wants to integrate data from patient-reported outcome questionnaires, findings from inpatient or outpatient visits at the hospital, and results from laboratory examinations.
Which entity types need to be integrated and from which application components do they come? Devise a plan how you would set up a sustainable research architecture, i.e., an architecture that also could be used in other research settings and for different disease or research entities, considering Sect. 6.6.
";"A clinical researcher at Ploetzberg Hospital has won a grant to set up a register for patients who have received a knee endoprosthesis.
Disease registers are research databases for collecting data about a specific disease, aiming for full coverage of the respective patient collective.
The aim of a knee endoprosthesis registry is to collect longitudinal data to find out which type of endoprosthesis works best over time.
The researcher wants to integrate data from patient-reported outcome questionnaires, findings from inpatient or outpatient visits at the hospital, and results from laboratory examinations.
Which entity types need to be integrated and from which application components do they come? Devise a plan how you would set up a sustainable research architecture, i.e., an architecture that also could be used in other research settings and for different disease or research entities, considering Sect. 6.6.
";"The following entity types have to be integrated: patient, person, diagnosis, finding, health record, medical procedure, patient record, self-gathered symptoms, material, medical device, classification, nomenclature.

Application components to be integrated depend on local settings and implementation but will likely include: patient administration system, MDMS, LIS, OMS, PDMS, and self-diagnosis systems (e.g., an app for collecting patient-reported outcome data) or patient portals.

A research architecture for setting up multiple registries might include a DWS for research that is fed via ETL processes from the above-mentioned application components and can be tapped for data in different use cases or research scenarios.
Finally, an open platform architecture would enable reuse of patient data in various research contexts.
";3;Book;
"Was ist an dieser Projektbeschreibung falsch?
            ◦ Problem: Auf dem Software-Markt existiert eine Vielzahl unterschiedlicher Informationssysteme, welche im Bereich der Krankenhaushygiene eingesetzt werden können. Der Funktionsumfang und der Einsatzbereich der Informationssysteme ist sehr vielfältig.
            Ziel: Ziel ist eine Systematik zur Erfassung von Informationssystemen und eine systematische Auflistung aller am Markt verfügbarer Informationssysteme im Bereich der Krankenhaushygiene.";"What is wrong with this project description?
Problem: There are many different information systems on the software market which can be used in the field of hospital hygiene. The range of functions and the field of application of the information systems is very diverse.
Goal: The goal is to create a system for recording information systems and a systematic listing of all information systems available on the market in the field of hospital hygiene.";Information Systems are not equal to Software products. The underlaying definition here is wrong and does not include human actors as an essential part.;1;A_2021;
Nennen Sie ein Beispiel für fehlende Datenintegration in der Pflege;Give an example of lack of data integration in care;Patient Admission, Daily Checks and Physical Documentation lead to redundant data management.;1;A_2021;
